question,answer
Sample cyclical starting with a manual email," Cyclical loop starts with a manual email        Sample Sequence4 steps, 4 daysThis sequence combines a call, automatic and manual email, and LinkedIn outreach. Personalized:           • Greeting to cover all time zones. E.g. ""Good {{part_of_the_day}}"" = ""Good evening"" • Recipients first name {{First Name}} • Recipients company name {{Company}} • Suggested next touch base day {{weekdays_from_now 2}} - e.g. ""Let's have a call on Friday"" • Sender's name {{Sender Company Name}} - sequences can be sent on  behalf of colleagues • Sender's company name {{Sender Company Name}} • Sender's  signature  {{Auto inserted Signature}} • Sender's  unsubscribe text  {{Unsubscribe Text}}    Skill up  Learn  how to use merge fields .   Step 1, Day  1 - manual email Subject: Hi {{First Name}}! Good {{part_of_the_day}} {{First Name}}, My name is {{Sender First Name}} and I head up business development efforts with {{Sender Company Name}}. We recently launched a new platform that [one sentence pitch]. I am taking an educated stab in the dark here, however, based on your online profile, you appear to be an appropriate person to connect with ... or might at least point me in the right direction. I’d like to speak with someone from {{Company}} who is responsible for [handling something that's relevant to my product]. If that’s you, are you open to a fifteen-minute call on _________ [time and date] to discuss ways the {{Sender Company Name}} platform can specifically help your business? If not you, can you please put me in touch with the right person? I appreciate the help! Best, {{Auto inserted Signature}} {{Unsubscribe Text}}  Step 2, Day 2 -  misc. step LinkedIn connection Connect on LinkedIn. Message...  Step 3, Day 4 - automatic email Subject: Following up on my lasy email I tried to reach out {{last_step_date}} through email and LinkedIn. Did you have a chance to check {{Company WebSite}} ? {{Auto inserted Signature}}   Step 4, Day 4 -  phone call Phone Call reach out Pitch the product or service. Leave a voicemail if no answer. "
Check out one of the sample sequences you can build using Revenue Grid," Mix of steps (RevenueGrid offering)        Sample Sequence15 steps, 18 daysThis sequence combines calls, automatic and manual emails, same day follow-ups,  and LinkedIn outreach. Personalized:           • Greeting to cover all time zones. E.g. ""Good {{part_of_the_day}}"" = ""Good evening"" • Recipients first name {{First Name}} • Recipients company name {{Company}} • Suggested next touch base day {{weekdays_from_now 2}} - e.g. ""Let's have a call on Friday"" • Sender's name {{Sender Name}} - sequences can be sent on  behalf of colleagues • Sender's company name {{Sender Company Name}} • Sender's  signature  {{Auto inserted Signature}}    Skill up  Learn  how to use merge fields .   Step 1, Day  1 - automatic new email thread Subject: Hi {{First Name}}! Good {{part_of_the_day}} {{First Name}}, My name is {{Sender First Name}} and I head up business development efforts with {{Sender Company Name}}. We recently launched a new platform that [one sentence pitch]. I am taking an educated stab in the dark here, however, based on your online profile, you appear to be an appropriate person to connect with ... or might at least point me in the right direction. I’d like to speak with someone from {{Company}} who is responsible for [handling something that's relevant to my product]. If that’s you, are you open to a fifteen-minute call on _________ [time and date] to discuss ways the {{Sender Company Name}} platform can specifically help your business? If not you, can you please put me in touch with the right person? I appreciate the help! Best, {{User Signature}}{{Unsubscribe Text}} {{Auto inserted Signature}} Step 2, Day 1, an hour later - automatic email reply Subject: Hi {{First Name}}! Sorry, forgot to mention - you can find more information on our website [Website] - I'll get back to anticipating your response. {{Auto inserted Signature}}  Step 3, Day 3 - automatic email reply Subject: RE: Hi {{First Name}}! Hey {{First Name}}, reaching out to you regarding my last email. I am pretty curious if you had a chance to go through it? Thanks! {{Auto inserted Signature}}   Step 4, Day 4 - phone call Outbound Call Call the number and pitch your product. Schedule a demo call. Leave a voice mail if no answer.  Step 5, Day 4, an hour later - misc. LinkedIn Connect Request Add the prospect on LinkedIn.  Step 6, Day 6 - automatic email reply Subject: 121% revenue velocity Hi {{First Name}}, I wanted to circle back regarding Guided Selling for {{Company}}. Think about your CRM guiding your reps to take the best steps in closing a particular deal. A Salesforce powered with Al signals helping in achieving ""Closed Won"" deals even faster. Gain in-depth visibility and control over your pipeline. Help your reps to take the best steps for closing deals effectively and strategically. All this with one quick glance on your screen. Transform your CRM from the system of records to a system of actions!  Thoughts? {{Auto inserted Signature}}  Step 7, Day 8 - automatic email reply Subject: 121% revenue velocity Salutations {{First Name}}, Did you have a chance to go through my last email? In case you missed it, please find attached a one-pager on what is Revenue Grid? Let me know if you have any questions. Best,{{User Signature}} {{Auto inserted Signature}}    Step 8, Day 10 - automatic email reply Subject: 121% revenue velocity {{First Name}}, The best thing about Revenue Grid is that it is a Salesforce Native solution and works right in your Salesforce. I want to visualize what Guided Selling looks like. Opportunity Engagement Reports -Instantly view how well your team is engaging with important deals. Get in-depth visibility on your pipeline with just a glance on your screen.   Stalled opportunities - Make sure never to drop the ball and act fast on deals that matter most with forecasting accuracy, relationship intelligence, and lots more.   Let me know your thoughts about it, and feel free to share your availability for a quick chat. I would love to show you Guided Selling in action. {{Auto inserted Signature}}  Step 9, Day 13 - automatic new email thread Subject: Have you been eaten by an Alligator? Happy {{today}} {{First Name}}, I am writing in hopes that you are still with us and have not in fact been eaten by an Alligator! If you are still indeed with us, please contact me so that I can once again sleep at night :) {{Auto inserted Signature}}  Step 10, Day 13, an hour later - phone call Follow-up call attempt Follow-up call attempt. If no answer, leave a voicemail.   Step 11, Day 14 - misc. LinkedIn Follow-up Try a different pitch on LinkedIn.   Step 12, Day 14, an hour later - automatic SMS  Send an SMS.   Step 13, Day 15 - automatic new email thread Subject: Hi {{First Name}}! Hi {{First Name}}, I really hope I’m not causing you to do this... A quick email reply will be enough if you’d like to talk about Salesforce and inbox integration or not. I hope you have a wonderful hour, day and week, {{First Name}}! {{Auto inserted Signature}} {{Auto inserted Signature}}  Step 14, Day 18 - automatic new email thread Subject: Hi {{First Name}}! Hasn’t our communication been fun?! - me, writing to you now and then; you, not responding… Perhaps, the stars simply didn’t align. Yeah, I definitely blame them, little shiny brats. Fun as it is, though, I want to tell you goodbye now and wish all the best to you. My understanding is that at the moment you might not be interested in Guided Selling Solution for {{Company}}, however beneficial it may be. Still, if you ever need one, I’ll be happy to hear from you any time. Plus I would really appreciate it if you can provide me little feedback on why Revenue Grid is not suitable for {{Company}}? So, best wishes to you and lots of success to {{Company}}. {{Auto inserted Signature}}  Step 15, Day 18, an hour later - misc. Good bye msg on LinkedIn Say a good bye on LinkedIn to look professional.  "
Sample fully automated email drip campaign," Fully automated email drip campaign        Sample Sequence6 steps, 15 daysThis sequence combines automatic emails and same day follow-ups. Personalized:  • Reference to a specific working day in the future {{weekedays_from_now 5}} • Share a link to book a meeting {{Sender BookMe Text}} • Greeting to cover all time zones. E.g. ""Good {{part_of_the_day}}"" = ""Good evening"" • Recipients first name {{First Name}} • Recipients company name {{Company}} • Day of the previous outreach {{last_step_day}}    Skill up  Learn  how to use merge fields .   Step 1, Day  1 - automatic new email thread Subject: A [better/smarter/faster] way to [reach a specific goal] Good {{part_of_the_day}} {{First Name}}, My name is {{Sender First Name}} and I head up business development efforts with {{Sender Company Name}}. We recently launched a new platform/product/service that [one sentence pitch]. I am taking an educated stab in the dark here, however, based on your online profile, you appear to be an appropriate person to connect with ... or might at least point me in the right direction. I’d like to speak with someone from {{Company}} who is responsible for [handling something that's relevant to my product]. If that’s you, are you open to a fifteen-minute call on {{weekdays_from_now 2}} or {{weekdays_from_now 3}} to discuss ways the {{Sender Company Name}} platform can specifically help your business? If not you, can you please put me in touch with the right person? I appreciate the help! Best, Step 2, Day 1, an hour later - automatic email reply Subject: RE: A [better/smarter/faster] way to [reach a specific goal] Happy {{today}} {{First Name}}. I think I forgot to leave my company’s website info – you can find out more at [Sender Company Website]! Plus, we can always meet! Pick a slot using the following link: {{Sender BookMe Text}} {{Auto inserted Signature}} Step 3, Day 3 - automatic email reply Subject: RE: A [better/smarter/faster] way to [reach a specific goal] Hey {{First Name}}, reaching out to you regarding my last email sent on {{last_step_day}}. I am pretty curious if you had a chance to go through it? Thanks! {{Auto inserted Signature}}  Step 4, Day 7 - automatic email reply Subject: RE: A [better/smarter/faster] way to [reach a specific goal] Happy {{today}} {{First Name}}. I know you are super busy, just though I would really love to connect for 15 mins whenever you are available and show our [describe the solution] in action. Attached is the brief synopsis of our product/services. As a quick reminder, here's the link to my calendar: {{Sender BookMe Text}} {{Auto inserted Signature}}  Step 5, Day 11 - automatic email reply Subject: RE: A [better/smarter/faster] way to [reach a specific goal] Hi {{First Name}}, I really hope I’m not causing you to do this... A quick email reply will be enough if you’d like to talk about [your solution] or not. I hope you have a wonderful hour, day and week, {{First Name}}! {{Auto inserted Signature}}  Step 6, Day 15 - automatic email reply Subject: RE: A [better/smarter/faster] way to [reach a specific goal] Hasn’t our communication been fun?! - me, writing to you now and then; you, not responding… Perhaps, the stars simply didn’t align. Yeah, I definitely blame them, little shiny brats. Fun as it is, though, I want to tell you goodbye now and wish all the best to you. My understanding is that at the moment you might not be interested in (your solution) for {{Company}}, however beneficial it may be. Still, if you ever need one, I’ll be happy to hear from you any time. Plus I would really appreciate it if you can provide me little feedback on why (your solution) is not suitable for {{Company}}? So, best wishes to you and lots of success to {{Company}}. {{Auto inserted Signature}} "
Sample recruitment sequence scenario consisting of automatic emails," Recruitment scenario        Sample Sequence4 steps, 7 daysThis sequence consists of automatic emails.Personalized:           • Recipients first name {{First Name}} • Recipients company name {{Company}} • Recipients industry {{Industry}} • Recipients company website {{Website}} • Sender's company name {{Sender Company Name}} • Sender's  signature  {{Auto inserted Signature}} • Owner's Book me link  book me link  {{Owner BookMe Text}}    Skill up  Learn  how to use merge fields .   Step 1, Day  1 - automatic new email thread Subject: A talk with {{Sender Company Name}} Hi {{First Name}}, I was impressed by your contribution to {{Company}} within {{Industry}} space and wanted to introduce myself. I’m a recruiter from {{Sender Company Name}} and seek people like yourself to join our team. I was wondering if you are up to a quick call to learn about {{Sender Company Name}} and specifically about the roles we offer currently. You can book a timeslot here: {{Sender BookMe Text}} Best regards, {{Auto inserted Signature}} Step 2, Day 3 - automatic email reply Subject: RE: A talk with {{Sender Company Name}} Hi again, I wanted to follow up on my previous email from 2 days ago about an open position at {{Sender Company Name}}. We believe that you are among the best in the industry and I would be excited to connect with you! Have you had a chance to look at our website: {{Website}}? Here are some perks and news from us: 1. XXXXXX 2. YYYYYYY 3. ZZZZZZZ Even if you are not specifically looking for a new role, it would be great to be on each other's radar! You can book a meeting with me here: {{Owner BookMe Text}} Best regards, {{Auto inserted Signature}} Step 3, Day 5 - automatic email reply Subject: RE: A talk with {{Sender Company Name}} Happy {{today}}, {{First Name}}. I know you are super busy, just thought I would love to connect for 15 mins whenever you are available and talk more about the opportunities at {{Sender Company Name}}. You can learn more at {{Website}}. As a quick reminder, here's the link to my calendar: {{Sender BookMe Text}} {{Auto inserted Signature}} Step 4, Day 7 - automatic email reply Subject: RE: A talk with {{Sender Company Name}} Hi {{First Name}}, This is one last follow to connect about potential positions at {{Sender Company Name}}. If you are even slightly interested, let's chat! Hope you are having a good day! Best regards, {{Auto inserted Signature}} "
Sample renewal sequence consisting of automatic emails," Renewal sequence        Sample Sequence2 steps, 4 daysThis sequence consists of automatic emails.Personalized:           • Recipients first name {{First Name}} • Sender's names {{Sender Name}} - sequences can be sent on  behalf of colleagues • Sender's company name {{Sender Company Name}} • Sender's  signature  {{Auto inserted Signature}}    Skill up  Learn  how to use merge fields .   Step 1, Day  1 - automatic new email thread Subject: {{Sender Company Name}}'s Subscription is ending soon Dear {{First Name}}, Your subscription to {{Sender Company Name}} is scheduled to end soon. If you wish to continue using our product, contact our team to renew your account. We would love to assist you with your decision. Please let us know if you have any questions. Best regards, {{Auto inserted Signature}} Step 2, Day 4 - automatic email reply Subject: RE: {{Sender Company Name}}'s Subscription is ending soon Dear {{First Name}}, I wanted to follow up on the email above about your subscription ending soon. Please reach out to us if you wish to keep using {{Sender Company Name}}. We would be very sorry to see you go. In case you do not want to prolong the subscription, let us know please. We will stop reminding about the renewal. Best regards, {{Auto inserted Signature}} "
Learn how to create sequences," Sequences 101 | Run sample sequences to settle in        The goal is to complete full cycle of engaging a prospect, starting from setting up the sequences. 1. Go to the Sequences tab.2.  Find  sequences ""Sample to be run - Auto step"" and ""Sample to be run - Manual step""3.  Clone  them.4.  Add recipients  to the sequences. Use template recipients.5.  Activate  the sequences.6.  Handle interactions , the replies from recipients and engage them.7. After engagement is done,  archive  the sequences.End. Sequence name: ""Sample to be run - Auto step""1 step, 1 day longStep 1, Day  1 - automatic new email thread Subject: Welcome to Engage - Automatic email Hello {{Title}} {{First Name}} {{Last Name}} from {{Company}}, We got an offer you can't miss out on. Here are the details... {{Auto inserted Signature}}  Sequence name: ""Sample to be run - Manual step""1 step, 1 day longStep 1, Day  1 - automatic new email thread Subject: Welcome to Engage - Manually edited email Hello {{Title}} {{First Name}} {{Last Name}} from {{Company}}, We got an offer you can't miss out on. Here are the details... {{Auto inserted Signature}} "
Sample renewal sequence consisting of automatic emails," PR scenarios        Sample - PR scenarios2 steps, 3 daysThis sequence consists of automatic emails.Personalized:           • Recipients first name {{First Name}} • Sender's names {{Sender Name}} - sequences can be sent on  behalf of colleagues • Sender's company name {{Sender Company Name}} • Sender's  signature  {{Auto inserted Signature}}    Skill up  Learn  how to use merge fields .   Step 1, Day  1 - automatic new email thread Subject: {{Sender Company Name}} News Release Dear {{First Name}}, Hi {{First Name}},   My name is {{Sender First Name}}, and I am the {{Sender Title}} at {{Sender Company Name}}. I’m reaching out to see if you’d be interested in a news release.  {{Sender Company Name}} has recently [done something newsworthy related to the topic]. For more details, please see the media kit: [link].  Would also be happy to arrange a comment and/or an interview [with CEO/CMO/other speaker] to tell you more about [my/his/her] experience with [topic]. Your readers might be eager to learn the following:   Key takeaways that summarize the press release and your/client’s/CEO’s expertise  For more information, you can see the media kit: [link].   Let me know if this is of interest.    Thank you,  {{Auto inserted Signature}} Step 2, Day 3 - automatic email reply Subject: RE: {{Sender Company Name}} News Release Hi {{First Name}},  A quick follow-up up to see if the [topic above] is interesting for you?   A few key points [I/client/CEO] can address:   Key takeaways that summarize the press release and your/client’s/CEO’s expertise  For more information, please see the media kit: [link].  Looking forward to hearing your thoughts on this! Thank you,  {{Auto inserted Signature}} "
Sample event follow-up sequence consisting of automatic emails," Event follow up        Sample - Event follow up3 steps, 13 daysThis sequence consists of automatic emails.Personalized:           • Recipients first name {{First Name}} • Sender's names {{Sender Name}} - sequences can be sent on  behalf of colleagues • Sender's company name {{Sender Company Name}} • Sender's  signature  {{Auto inserted Signature}}    Skill up  Learn  how to use merge fields .   Step 1, Day  1 - automatic new email thread Subject: Thanks for coming to {{Sender Company Name}}'s booth at [Event] Hi {{First Name}},  It was great meeting you last night at [Event]. I hope you found the information that we presented insightful.  If you have any additional questions, feel free to reach out to me! Best regards, {{Auto inserted Signature}} Step 2, Day 7 - automatic email reply Subject: RE: Thanks for coming to {{Sender Company Name}}'s booth at [Event] Hi {{First Name}},  I thought you might find this article handy: [link to some material/report that is related to the sender's industry] It talks about [short summary of the article]. Hope you find it useful! If you are interested in chatting more about [topic of the article], send me a quick reply or choose a timeslot in my calendar: {{Owner BookMe Link}} Best regards, {{Auto inserted Signature}} Step 3, Day 13 - automatic email reply Subject: RE: Thanks for coming to {{Sender Company Name}}'s booth at [Event] Dear {{First Name}},  If you are interested in learning more about {{Sender Company Name}}, I would love to show you a demo of what {{Sender Company Name}} can do for you! You can easily choose a time slot that works for you from my calendar: {{Sender BookMe Link}}. Best regards, {{Auto inserted Signature}} "
Enhance your sales performance with Revenue Grid Sequences daily digest," The Daily Sequence Digest           Daily sequences digest keeps you focused on what's important in regards to your automated Sequences that engage prospects. It notifies you how many sequences are active and how many prospects in the sequences are stuck and need your attention immoderately.  Why are you receiving the Daily sequences digests?Once you create a sequence, Revenue Grid starts sending you a daily digest to keep you in the loop.   How to interpret the data?The number of the Action Center items indicates how many recipients are at the point where you have to take an action manually. Each Action Center item is related to a single prospect in your sequence. Items may include:  Replies from your prospects    Notifications    To-do items to ensure smooth outreach to a certain prospect    All these items are clickable, so you can conveniently open the necessary Action Center page and take the required actions.!!! warning ""Important""    Unless you take the action to resolve each item separately, the corresponding prospect will not proceed within a sequence.  Running vs idling sequencesRunning sequences are those  which are activated , whereas idling are inactive ones.    Hint   Read more about how to ensure smooth operation of your sequences.      Disable the Daily sequence digest for your accountYou can turn off Sequences Daily Digest by clicking on the ""Turn off the daily digest"" in the email body and unselecting the ""Receive daily sequence digest"" checkbox on the newly opened page. ALternatively,   1. Go to Settings → Sequences subtab 2. On the General tab, unselect the ""Receive daily sequence digest"" checkbox 3. Click Save to apply the changes    Disable the Daily sequence digest company wide   1. Go to Settings → Signals subtab. 2. Click  Create Signal .  3. Choose  Sequence email digest  in the  Signal preset  drop-down. 4. Toggle the switch to stop receiving the digest company wide.   "
See the team members' items that still require an action in their Action Center<," Monitor the performance of each employee with Sequences Required Actions report[this article is work-in-progress]      The Sequences Required Actions report enables the Sequences Admins to monitor the performance of their subordinates. Sequences Required Actions includes the full list of employees and the number of each user’s active items ([replies](../Replies/), [notifications](../Notifications/), [to-dos](../to-dos/)) in the Action Center that still require an action from the user in their Action Center.      !!! tip ""Tip""    Why is it important to monitor these figures?     The number of items in the Action Center corresponds to the number of paused sequences. Thus, the goal of each employee is to keep the number of replies, to-do items, and notifications at zero level.    Monitor the performance of every userClick on any number in the report to open the Action center belonging to the corresponding user and look through any to-do item, notification, or reply for coaching purposes.   Admins cannot take any actions on to-do items, notifications, and replies belonging to other users. The admins can access them in the read-only mode. Such items are marked with an eye icon.  The admin can act on the to-do items belonging to another user in their Action Center, only if the user has [delegated access](../Delegation/) to the admin to do so. "
