question,answer
Learn how to manage prospect profile and engagement history in Revenue Grid," Prospect profile and engagement history        Click a prospect to see contact details and logged engagement history. Prospect contacts and detailsThe detailed prospect card includes the following information: - The  prospect's status  - Indicator if a prospect saved in Salesforce as Lead, Contact, or other:    Prospect linked to Salesforce Lead   Prospect linked to Salesforce Contact No icon - Prospect has been  imported from a CSV file  directly to Revenue Grid or added  manually as a single record using the  Add a new prospect  button. The prospect is not linked to any Salesforce record  - Company name, contact information (email, phone number)  - The date and time when the prospect was last contacted  - Engagement statistics for the prospect: number of calls made, emails sent, emails opened (with help of built-in Revenue Grid email tracker), link clicks, and replies received.     Manage a prospect. More Actions.Use   icon to open the list of available actions to perform on a single prospect. Refer to this list of  available actions . All data presented in the Overview pane adds important insights into your outreach marketing analytics.   How to find out in what sequences a prospect has been so far?   The right-hand side pane shows a timestamped communication and event log in chronological order happened with a prospect.  Important events (e.g. for example  prospect's stage  change,  Owner Change ,  Lead Conversion ) which happen to a prospect during the life cycle within Revenue Grid, can be identified by the icons.  The very first record on the History Feed is always date of import to Revenue Grid and user name of the employee who has done the import.  Every Sequence-related record in the History feed has number of Step for easier engagement analytics.  Here is the full list of possible values, with associated icons, which you can find on the pane:     Description  Icons      Email opens.        Links clicks.        Signal type of a step.       Manual and Automated emails.    Look at item  6)  to learn  more how to make an email  automated or semi-automated        Manual and Automated SMSs.    Look item  3)  to learn  more how to make an email  automated or semi-automated        These represent Misc. and Phone call types of steps.       Both of these items mean that you have received a response, either from the prospect you are reviewing, or from the prospect's colleague who is being reach-out by the same sequence in your Revenue Grid.       1. Marked as finished as ""Success"" 2. and 3. are examples of unsuccessful engagement. Either  ""Unresponsive"", ""Not interested"", ""Opted out"" etc. 4. Notification that the prospect's owner has been  changed in Salesforce.       1. Indication that the prospect has been removed from a sequence, along with the user who have done it. 2. Indication the the Sequence has been paused for the prospect.       1. This grey icon means that you replied to a prospect's meeting invitation. 2. This is an indication that you have received a meeting invitation. 3. Lead conversation notification means that the prospect has been converted to a lead in Salesforce. 4. This is very first item in every History Feed, date of import to Revenue Grid along with the users name who did it.       Icons with label ""Skipped"" and ""Muted"" indicate which steps have been skipped and muted.        "
Detailed overview of Revenue Grid Prospect Statuses," Revenue Grid Prospect Statuses         Every prospect in Revenue Grid is assigned a certain Person Status based on their reaction to Sequence steps. The life-cycle of statuses start from  Just Added , once a prospect gets imported into Revenue Grid. Prospect status updates can be:- automatic, triggered by a [Sequence stage change](../Sequences-Stages/)- initiated by users on Revenue Grid side on [Action Center](../Planner/), [Audience](../People/), [Sequences' Recipients tab](../Recipients/) or via [Sequence widget](../Sidebar/)- or initiated by users on Salesforce side and get reflected on Revenue Grid side automatically according to [custom mapping](../Prospect-Statuses/custom_salesforce_mapping)!!! tip ""Tip""    If you do not want prospect's Revenue Grid status to get updated automatically when a Sequence [proceeds to its next stage](../Sequences-Stages/), clear the ""Update Person status on Sequence Stage Change"" checkbox in the [Sequence's settings](../Settings-of-Sequences). That is useful, for example, if running a secondary nurturing [email Sequence](../Create-new-sequence/).------ Default types of Person statusesJust added  - prospect has been added to [Audience page](../People/) but it's not involved in any Sequences yet.Not contacted  - this status indicates that a prospect has been added to a sequence, but no outreach has been made yet.Approaching - prospect engagement is in progress, going through the [steps](../Create-new-sequence/adding_and_editing_steps_toof_a_sequence) according to the sequence schedule.On hold - this status is assigned manually by a RG user. Such prospect will not proceed to a following step within any Sequences enrolled.Success - this status is assigned manually by a RG user by clicking ""Finish: Success"" on [Action Center's Replies tab](../Replies/), on the [Sequences' Recipients tab](../Recipients/mass_actions) or via [Sequence widget](../Sidebar/). This status means that the engagement was successful, thus sequence will not reach out to this prospect anymore and further negotiations will take place outside of Revenue Grid.Not interested  - this status is assigned manually by a RG user by clicking ""Finish: Not interested"" on [Action Center's Replies tab](../Replies/), on the [Sequences' Recipients tab](../Recipients/mass_actions) or via [Sequence widget](../Sidebar/) when a prospect expresses his/her disinterest in this campaign. However, this prospect can still be contacted in a course of other campaigns.Opted Out - this status can be assigned both, manually or automatically. Manually by a RG user by clicking ""Finish: Opt Out"" on [Action Center's Replies tab](../Replies/), on the [Sequences' Recipients tab](../Recipients/mass_actions), on the [profile page](../People/contactlead_profile), or via [Sequence widget](../Sidebar/). Also it may happen automatically if a prospect clicks [the unsubscribe link](../Settings/unsubscribe_links) in a received email.Bounced - this status is also can be assigned both, manually or automatically. Manually via [RG Sequence widget](../Sidebar/). Automatically, if a [hard bounce](https://whatis.techtarget.com/definition/hard-bounce) delivery failure notification was received in response to a [Sequence email](../Create-new-sequence/email_type_of_a_step), then Revenue Grid will change this prospect's status to Bounced; in addition, the delivery failure automatic email will be put to the [Notifications](../Notifications/) tab in the Action Center. !!! tip ""Note""    If a prospect has Bounced status, then it's not going to be possible to Opt out the prospect anywhere throughout Revenue Grid. Whether on [Audience](../People/mass_action), [Prospect's Profile page](../People/contactlead_profile), [Recipients](../Recipients/mass_actions) tabs nor via the [Sidebar](../Sidebar).Unresponsive - this prospect status is automatically assigned if there has been no response from a prospect to [automated email sequence messages](../Create-new-sequence/email_type_of_a_step) for 1 week. In this case either another communication channel should be used or another lead from the same company should be engaged. If a prospect responds some time later, the status can be updated to Success, Not interested, or Opted out.    Custom Salesforce mapping to boolean or pick-list types of a fieldWhen a contact’s or a lead’s status changes in Revenue Grid, it may get reflected in Salesforce according to custom mapping. It also may work other way around; if a status changes directly in Salesforce, then it gets reflected in Revenue Grid. Custom mapping of Revenue Grid statuses to Salesforce depends on each company’s needs and business flow.   Here is an example how it works   Let's say you mapped an additional field (Rating) and its value (Warm), to the ""Approaching"" status. Explained: When a lead's Person status changes to Approaching in Revenue Grid, along with Salesforce field (Status) changing to ""Attempting to Contact"", also another Salesforce field (Rating) will get populated with corresponding value (Warm). And since the ""Bidirectional"" checkbox is selected, similarly the mirroring will happen other way around as well. If the field (Rating) of a lead gets changed to (Warm),  AND  in the field (Status) gets changed to ""Attempting to Contact"" in Salesforce, then the lead's Person status in Revenue Grid will be changed to ""Approaching"".      How to create a new custom Prospect status and map to a Salesforce field (boolean or pick-list types)Go to  Settings→Status mapping  8 steps  1. Choose what type of a status you want to add a new item to (you can add to Success or to Failed statuses, not to General ones)  2. Click ""New status"" button  3. Name you new status and click Confirm icon  4. Click ""New mapping"" button  5. Choose a Salesforce field (boolean or pick-list types)  6. Choose a value for that field to be populated once a prospect gets assigned the status  7. Press ""Save"" button on the bottom of the page 8. OPTIONAL: If you want the status to get mirrored bidirectionally, then select the corresponding checkbox.   When selected, not only the chosen field will be populated with the chosen value in Salesforce once a prospect is assigned the corresponding Person status, but other way around as well. Meaning, if the chosen value gets populated in Salesforce, then in Revenue Grid the prospect's status will be changed to the corresponding one.    Refer to this article for description of [Sequence stages](../Sequences-Stages/stages_of_sequences)."
Assignees selection strategies for Revenue Signals<," Select Assignees for Revenue Signals[ This is the article for Signals managers]       The assignees for most of Revenue Signals are predefined based on their relationship to Salesforce objects or activities (events, emails); however, some Signals feature advanced assignees configuration options (e.g. [Chosen conditions met for the Salesforce object](https://docs.revenuegrid.com/ri/fast/articles/signals-settings-and-parameters/1_chosen_conditions_met_for_the_salesforce_object)) when Revenue Grid admins can select the assignees who are to receive a specific Signal.   So far, four assignees selection options are implemented for such Signals:   Assignees are selected based on the Salesforce relationship: 1. The signal notification is sent to the user who is the Salesforce object owner.  Assignees are selected based on custom preferences:  2. The signal notification is sent to the manager of the user who is the Salesforce object owner. 3. The signal notification is sent to a list of RG users.  Assignees are selected based on custom assignees template:  4. The signal notification is sent to the users specified in the Json format in the field Custom assignees template. The JSON example of the custom assignees template for selecting the Salesforce opportunity owner, Salesforce opportunity owner's manager and all Signals managers, and excepting the users specified in the list of their IDs: ```{     ""include"": [         {             ""type"": ""SalesforceRelationshipSelectorRule"",             ""objectType"": ""Opportunity"",             ""relationship"": ""OwnerId""         },         {             ""type"": ""SalesforceRelationshipSelectorRule"",             ""objectType"": ""Opportunity"",             ""relationship"": ""Owner.ManagerId""         },         {             ""type"": ""ManagersSelectorRule""         }     ],     ""exclude"": [         {             ""type"": ""UserIdsSelectorRule"",             ""userIds"": ["" ""]         }     ] } ```"
Manage the list of Leads/Contacts to be reached out via the Sequence on the Recipients tab in Revenue Grid ," Recipients tab of a  Sequence           This tab is used to manage the list of Leads/Contacts to be reached out via the Sequence.    Where I can add recipients from?   You can add recipients to a sequence from:   • Salesforce views, reports, campaigns;  • Among those who had been imported to Revenue Grid earlier;  • An a CSV file;  • Or simply to punch in a single prospect manually straight to Revenue Grid;   Follow the extended A-Z instructions on how to add recipients  here .     How to find a recipient in a sequence? Use  Search  field to find a recipient by name, company, email. Also you can filter the list by Salesforce owner, or by current  stage . Use Filter drop down to narrow your search. Among many criteria you can select recipients that have replied to any of outreaches of the sequence.    Export Recipients to a CSV fileIf the settings  Allow recipients export into CSV  is enabled by your Revenue Grid admin, you'll be able to download list of recipients to your local computer in CSV format. Use the Download icon in the top right-hand side corner of the screen.   Find the recipients that are on a certain step   Say you want to know who among the recipients are on step number 2. Refer to this left hand side area and click the day you want to see the recipients of. The main table of  Recipients tab  will be filtered down to show just those who are on that step.    Recipient's next step within a sequenceRefer to the  Next step  column to find out what is planned next for a recipient. Click  here  to see the complete list of possible values.    Actions required so a recipient proceeds to the next stepWhen a recipient is stuck on a step, refer to the  Action required  column on the Recipients tab of the Sequence.  Click an action that appears in the table, and you will be redirected to the corresponding item in the Action Center. In order to run your sequence uninterrupted for every recipient, keep a close eye on the  Action Center , that's your main processing pad for the sequences. Click  here  to see the complete list of types of  Action required .   Where else I can see Action required?Action required will also appear in the  Sidebar's Sequences widget .    Find out on what stage a recipient currently isRefer to the  Stage  column to find out on what stage a recipient currently is. Click  here  to see the complete list of stages.   Find the most engaged recipients Prospect communication  Stats : the number of conducted calls, sent emails, emails opened, links in the emails clicked, and replies. In order to see the most engaged prospects/leads, click the   icons.   Read about how email opens and link clicks get counted  here .       Mass and single prospect actions    In the more options icon, whether you selected several prospect or clicked on the   icon on a single prospect, you can perform these actions:    Add  - Engage the prospect into another sequence.    Delete  - Completely erase the prospect from Revenue Grid.    Re-import  - Use this in case you want changes of a lead or a contact to get pulled from SFDC to Revenue Grid on demand.    Add tags  - Add or remove tags to single or multiple prospects at once.    Opt out  - Finish the Sequence for the prospect marking Person Status as Opt out, meaning the prospect requested not to get contacted anymore.    Bounce  - Set the  Prospect status  to bounce manually.    Move  - Stop the sequence for the selected prospects, and move them to another sequence.    Remove  - Withdraw the prospect for the Sequence.    Skip  - Pass by the current step and execute the next following step instead on the current step's schedule.    Mute  - Pass by the current step and let to the following step get executed without changes in the following step's schedule.    Pause  - Put the Sequence for the prospect on hold.    Continue  - Proceed within the sequence.    Reschedule  - Set new time for the next coming step.    Stop  - Stop the Sequence for the selected prospect. This action is irreversible. If you want temporarily halt the Sequence for the prospect, then you should use  Pause .  Prospect status  will be set as Stopped. You can map this status to any other Salesforce status in  Status mapping settings .    Run now  - Run the scheduled step right away.    Personalize  - Select when you want to personalize the next scheduled step. When selected, an additional item will appear in the Action Center, where you can edit the upcoming outreach.    Finish: Success  - Finish the Sequence for the prospect marking  Prospect status  as Success, meaning that engagement has been successfully completed and further negotiations are being taken care.    Finish: Not interested  - Finish the Sequence for the prospect marking  Prospect status  as Not interested, meaning that the prospect expressed disinterest in your product. Any  custom Person Statuses  you create in your Revenue Grid will be available in this menu as well.    Related article:    How to create a custom Person status in Revenue Grid, and map it to a Salesforce field.    How to add recipients to a sequence.   "
Revenue Signals for Opportunities and Accounts to navigate the sales process to closed-win," Signals of a single opportunities or account         Revenue Signals to navigate the sales process to closed-win   There are signals related to the opportunity. For more information about Revenue Signals,  refer to this article .     Add a signal to recommend the must action.  "
Learn how to use the interactive relationship chart to see all your colleague interactions with representatives of the opportunity," Relationship intel of a single opportunity or account         All involved parties captured and saved Relationship Intelligence on the People chart.   This is an interactive relationship chart. Here, you can see who of your colleagues has been in touch with representatives of the opportunity.    On this chart you can see role of the people involved, total recorded communication by type (calls, emails, meetings), and recorded communication between two particular individuals by hovering over the patch between them.      Contacts who appear on the customers' side of the chart (the right side), have additional elements which help you to identify:  - if a contact is in Salesforce. If not, then use the button to create a contact seamlessly in Salesforce and associate with the opportunity. - contact card which has data parsed from email from the contact and information stored in Salesforce, or supplementary data found via a search engine:    Bing.   "
