question,answer
Learn how to use and navigate in the Intelligence Package part of the Revenue Grid Knowledge Base," Intelligence Package: Introduction           Revenue Grid Intelligence Package is the revenue intelligence product offered by Revenue Grid.  It enables managers and sales representatives to detect and address revenue leaks in their pipelines, optimize sales processes, and boost revenue generation performance.  Intelligence Package part of the Knowledge Base has the following sections:   Get started  includes the initial first steps when you start using sequences in Revenue Grid.         Opportunities  section contains practical use guides on managing Opportunities in Revenue Grid.        Accounts  section contains practical advice on handling Accounts, insights and best practices.        Signals, action items & notes  describes how to create, manage, and act upon smart Revenue Signals, action items, and different types of notes.        Reporting & Forecasting  contains tips on enhancing your sales forecasting.        Team Performance  section contains information about coaching based on specific data and gaining team performance insights.        Conversational intelligence  contains tips on benefiting from meeting recordings and insights.        Admin guide  contains detailed Administrator's guides on product deployment and fine-tuning, as well as user management.        Release Notes:  information on the latest product updates – new features, improvements, notable bugfixes, etc.          NB: for readability considerations, in Knowledge Base articles Revenue Grid is referred to as RG. Copyright © 2005-2023 Revenue Grid. All Rights Reserved Worldwide. All other company and product names in the Knowledge Base are trademarks or registered trademarks of their respective holders."
Learn how to achieve the best results in your sales process with automated RG sequences for sales engagement," Revenue Grid Sequences: Introduction           An essential communication automation feature offered by Revenue Grid (RG) is managing sequences in efficient conjunction with registering all activities and status changes in Salesforce. A sequence is a series of communication steps (actions) a Revenue Grid end user performs to engage and nurture Leads and Contacts retrieved from their Salesforce, delivering campaign information and collecting responses via different channels. The sequence's steps follow a specific flow configured by RG users; both inbound and outbound email communication within a Sequence is automatically registered in Salesforce. Several consequential Sequences can be used in communication with the same group of prospects. For example, if an initial engagement sequence is successful with a prospect, you can switch this prospect to a different sequence for further nurturing.   Another related application of email Sequences is to follow up on product or service sales to measure user satisfaction or send out other kinds of surveys or product updates.  Engagement Package part of the Knowledge Base has the following sections:   Get started  includes initial configuration and recommended first steps when you start using sequences in Revenue Grid. Here you can also find some sample sequences you can experiment with.        Using sequences  section contains practical use guides and articles providing in-detail descriptions of various nuances of product functioning.        Sequences in Action Center  section contains practical advice on handling sequences and recipients' interactions with the sequences' steps (e.g., replies, auto-replies, etc.), making call, sending SMS, and reviewing notifications.        Sequences in Sidebar  section contains tips on handling sequences in RG Email Sidebar.        Team performance  includes a description of the reports on your team's performance and productivity in terms of sequences.        Personal settings (user)  include personal settings available to users having corresponding permissions        Admin guide  contains detailed Administrator's guides on product deployment and fine-tuning, as well as user management.        Troubleshooting  section contains step-by-step solutions to known issues which may occur with RG sequences.        Release Notes:  information on the latest product updates – new features, improvements, notable bugfixes, etc.        FAQs  section contains popular user inquiries about sequences in Revenue Grid.      NB: for readability considerations, in Knowledge Base articles Revenue Grid is referred to as RG. Copyright © 2005-2023 Revenue Grid. All Rights Reserved Worldwide. All other company and product names in the Knowledge Base are trademarks or registered trademarks of their respective holders."
"Complete guide to users and admins’ access rights to sequences, templates and prospects"," User roles and permissions in Revenue Grid        What regular users can do vs what admins can doA regular user can: Sequences  • Create Sequences. •  Clone   shared  sequences created by other users. • View sequences that have ever included recipients the user owns in Salesforce. • View and edit own private or shared sequences.   Recipients  • Add own (on Salesforce level) recipients to private or shared sequences. • Add any accessible (on Salesforce level) recipients to private sequences. • Can view  replies  from recipients and run  actions  on recipients if senders is the user. • Can view the complete  prospect profile  of own(on Salesforce level) recipients, or limited  prospect profile  of recipients who have ever received an email from the user. The limitation in such case is, the user will see only those events in the History Feed, which are related to the user, other events will be hidden.   An admin can: Sequences  • View/pause/activate other user's private sequences. • View/pause/activate/edit other user's shared sequences.   Recipients  • Can view  prospect profile  of all recipients.  Templates  • View/pause/activate other user's private templates. • View/pause/activate/edit other user's shared templates.   A delegatee can: Can do everything on behalf of the delegator user.  "
Learn how to make the best use of the insights on the Account details page," Comprehensive Account insights for the best decisions        On this tab you can find a comprehensive set of data points that help you to dig into communication details and progress. All data on the tab is 100% live data gathered and processed from emails, calendars and Salesforce. On this all-inclusive pad, you get:    Emails and Meetings   Relationship Intelligence   Engagement highlights   Related Signals   "
Complete guide on affective use of the statistical data on the RG Accounts tab," Account-based selling 100% transparent and intuitive        On the Accounts tab you can oversee and analyze communication developments per each account. It blends in data gathered from Salesforce, email clients and calendars of all who are involved into sales progress. All information shown is 100% in real-time.    How much total negotiations has taken place   The Engagement column shows a number of activities which has accumulated.    Meetings   Inbound emails   Outbound emails       By clicking on each, a pop-up will appear on the screen with details of each record made to the total number.      You can drill down all the way to the core of the record. By clicking on a record you are able to read the actual context of emails, or meetings details, which are being pulled directly from email client and calendars, no data is stored anywhere else.   All who has been involved   All engaged people. Number of representatives participated in meetings or have been involved into the correspondence from your and account's sides.    What was the Last touch   This column is filled automatically and indicates what was the most recent touch with the account. Our sentiment analysis will mark every email on the spectrum   from very negative to very positive. By clicking on the value, you'll be able to see the context of an email or meeting details for the maximum insights.    The next step    The Next step is being automatically scrapped from calendars, if it's a meeting, or from Salesforce when Sales reps fill up a corresponding field in Salesforce, and placed into the  What's next  column.     Uncover more value in the Extended view mode   Switch the view of the whole tab between regular and extended views.    Find the account you are looking for   You can filter down the accounts by categories. These categories include accounts stages, statuses, Salesforce fields, roles hierarchy and many more.   Add additional fields   You can modify the main table on the Accounts tab by adding additional fields from your CRM. In order to do that, click the ""More column"" icon. Pick a new column you want to appear in the table. Choose among all fields stored in CRM.   "
The full list of types of actions you can find in the Action required columns on the Recipient's tab and on the Audience page," Details of each and every possible  Action required            Here is the full list of types of actions you can find in the  Action required  columns on the  Sequence name →Recipient's tab and on the Audience page. Items are clickable and once clicked on, you will be redirected to corresponding item on the  Action Center's To-do tab  to take an action.   •  No action  - Take a brake  •  Review Response  - When a contact replies to one of your Steps, then Sequence gets paused until you to process the reply in the Action Center. Just click on the label if clickable and it will take you to the according item •  Review email Draft  - This means a contact is on a Step which requires manual review in the Action Center before sending out your email •  Make a call  - A contact is on a Phone Call type of a Step. Proceed to the Action Center to log a call •  Send text  - A contact is on a SMS type of a Step. Proceed to the Action Center to log a text message •  Review owner change  - This comes up when a contact's owner changes in Salesforce •  Fix merge field issue  - When you use a field to merge it to your Step message from Salesforce, but that field is blank in Salesforce. You may fix it either by removing Merge Field from your message, or by filling out required field in Salesforce •  Digest  response to a colleague - With certain settings in place, a Sequence prevents outreach to a contact, whose colleague's has already replied to any of Steps of the Sequence •  Review Invite Response  - it appears when a recipient sends you a meeting invite (both from Exchange or Gmail clients), or responses to your meeting invite sent from your email. All sequences a prospect is engaged into get paused for the recipient until resumed manually    Note  Both types of  Review Invite Response  type of notifications appear in the Action Center's  Notifications tab  with a respective icon    if a meeting invite has been sent to you;   if a recipient accepts or rejects a meeting invite which you had sent;     •  Perform other action  - This is related to Miscellaneous type of a Step • Digest another reply - The value means that a prospect replied to one or several Sequences of your colleague's, and the colleague is having ""Reply received email"" type of a required action for the prospect •  Review Notification  - Means either you received an Auto-reply or a standalone email. Those appear on the Notifications tab in the Action Center   •  Review conversion  - means that a lead has been converted to a contact on SFDC side, and you should process To-Do item on the  Action Center  so the sequence proceeds for the contact        •  Review send error       Book a free demo  "
Revenue Grid activity tracker explained: metadata processing for enhancing your sales performance," Invisible activity tracker plays a crucial, cross-functional role under the hood       Real time sales guidance mechanisms of Revenue Grid are backed up by metadata which is being collected, parsed, indexed and stored on the secured servers. Metadata includes details of email correspondence and calendar items company wide.  Once such activity is detected, it gets parsed, categorized and matched to information stored in Salesforce. Such implementation is carried out via  Gmail API ,  Calendar API ,  Drive API  for Gmail inboxes; and via  Exchange Web Services (EWS)  for MS Exchange and Office 365 inboxes. Values in Revenue Grid interface derived from Activity Tracker While reviewing  Pipeline Visibility  and  All Accounts dashboard , the count of sent/received emails, conducted meetings, people involved total, as well as the most recent touch details are possible due to the Activity Tracker running on the background.   People Intelligence charts on the  Opportunities 360  and  Account details  tabs, which show who from your company have been in touch with each of representatives of an opportunity is possible because of the Activity Tracker.    Activity trend charts on the  Opportunities 360  and  Account details  tabs, which show all meetings and email scattered on a timeline is being drawn based on records captured by the Activity Tracker.    Engagement highlight blocks on the  Opportunities 360  and  Account details  tabs, which consolidate pieces of information such as the first and the last touches, certain types of ""What's Next"" values are also being drawn based on records captured by the Activity Tracker.   Many  Signals  are being triggered based on conditions captured by the Activity Tracker. For example a signal notifying that a meeting follow up has been sent out by a Sales Rep; or Activity Summary Signals, which gather and send summary of executed actions on regular basis.    Number of sent/received emails and conducted meetings per employee on the  Team tab  gets reflected based on records captured by the the Activity Tracker.     Streaming data vs Activity Tracking  While ability to see an indication that there has been a certain number of emails is possible due to the Activity Tracking component. Whereas being able to drill deeper and actually read context of an email with just a click, gets carried out by streaming the context right from employee's inbox. No data is stored anywhere else.  "
Learn how to use RG Activity Trends tab to facilitate the transparent and effective communication between your sales team with opportunities and accounts," Activity trends of a single opportunity or account         Full transparency of talks for the best guiding All emails and meetings of an Opportunity or an Account in one place. On this chart, you can find all communication scattered on the time line. Data plots correspond to one of three types of activity: a meeting, an inbound, and an outbound email. Besides the data plots, important changes such as Close Date Change, Amount Change, First and Last Touches also get reflected on the chart for easier pipeline analytics.   Drill down to the point  By clicking on any given data plot, you can see the actual communication activities in the pop-up, from which you can read any given email or see details of a meeting.   "
